{"schema_version":1,"mode":"demo","generated_utc":"2026-10-19T12:00:00Z","as_of_utc":"2026-10-19T12:00:00Z","source":"demo-generator","strategies":[{"id":"S01","name":"THREE_BAR_MOMENTUM · NORMAL · 30s · RANGE","pattern":"THREE_BAR_MOMENTUM","action":"NORMAL","horizon_s":30,"regime":"RANGE","status":"REJECTED","p_adj":0.967,"splits":{"train":{"trades":74,"mean_r":-0.297,"ci_low":-0.4,"ci_high":-0.187,"win_rate":0.405,"profit_factor":0.386,"max_dd_r":22.23},"validation":{"trades":25,"mean_r":-0.128,"ci_low":-0.289,"ci_high":0.036,"win_rate":0.48,"profit_factor":0.705,"max_dd_r":4.54},"test":{"status":"NOT_EVALUATED","trades":null,"mean_r":null}},"equity":{"t":[1789948800,1789968872,1789988944,1790009016,1790029088,1790049160,1790069232,1790089304,1790109376,1790129448,1790149520,1790169592,1790189664,1790209736,1790229808,1790249880,1790269952,1790290024,1790310096,1790330168,1790350240,1790370312,1790390384,1790410456,1790430528,1790450600,1790470672,1790490744,1790510816,1790530888,1790550960,1790571032,1790591104,1790611176,1790631248,1790651320,1790671392,1790691464,1790711536,1790731608,1790751680,1790771752,1790791824,1790811896,1790831968,1790852040,1790872112,1790892184,1790912256,1790932328,1790952400,1790972472,1790992544,1791012616,1791032688,1791052760,1791072832,1791092904,1791112976,1791133048,1791153120,1791173192,1791193264,1791213336,1791233408,1791253480,1791273552,1791293624,1791313696,1791333768,1791353840,1791373912,1791393984,1791414056,1791434128,1791454200,1791474272,1791494344,1791514416,1791534488,1791554560,1791574632,1791594704,1791614776,1791634848,1791654920,1791674992,1791695064,1791715136,1791735208,1791755280,1791775352,1791795424,1791815496,1791835568,1791855640,1791875712,1791895784,1791915856],"r_cum":[-0.451,-2.051,-1.99,-3.59,-4.113,-3.078,-2.823,-2.818,-3.493,-3.106,-3.327,-4.927,-4.559,-5.007,-5.549,-5.127,-5.061,-5.222,-6.822,-7.494,-7.44,-5.84,-6.658,-5.855,-6.753,-6.47,-6.079,-6.304,-6.608,-7.27,-7.681,-7.98,-8.17,-7.69,-7.352,-8.15,-7.495,-8.593,-8.572,-8.084,-9.454,-9.645,-8.988,-10.588,-10.678,-11.744,-13.344,-12.433,-12.908,-12.372,-12.527,-12.447,-14.047,-14.743,-13.722,-14.214,-14.108,-15.269,-15.199,-16.799,-15.758,-15.938,-15.544,-15.974,-17.07,-17.489,-18.331,-18.282,-19.511,-21.084,-22.684,-21.998,-21.42,-21.977,-23.246,-21.796,-22.834,-22.368,-21.369,-22.361,-22.423,-22.877,-24.477,-23.743,-23.285,-24.73,-24.016,-24.487,-24.459,-24.452,-25.55,-25.906,-24.306,-24.582,-24.407,-24.596,-24.024,-25.624,-25.176],"split_index":[74,99]}},{"id":"S02","name":"THREE_BAR_MOMENTUM · REVERSE · 60s · TREND_UP","pattern":"THREE_BAR_MOMENTUM","action":"REVERSE","horizon_s":60,"regime":"TREND_UP","status":"REJECTED","p_adj":0.967,"splits":{"train":{"trades":120,"mean_r":-0.083,"ci_low":-0.224,"ci_high":0.046,"win_rate":0.475,"profit_factor":0.786,"max_dd_r":18.79},"validation":{"trades":25,"mean_r":-0.168,"ci_low":-0.524,"ci_high":0.142,"win_rate":0.4,"profit_factor":0.645,"max_dd_r":6.24},"test":{"status":"NOT_EVALUATED","trades":null,"mean_r":null}},"equity":{"t":[1789948800,1789962504,1789976208,1789989912,1790003616,1790017320,1790031024,1790044728,1790058432,1790072136,1790085840,1790099544,1790113248,1790126952,1790140656,1790154360,1790168064,1790181768,1790195472,1790209176,1790222880,1790236584,1790250288,1790263992,1790277696,1790291400,1790305104,1790318808,1790332512,1790346216,1790359920,1790373624,1790387328,1790401032,1790414736,1790428440,1790442144,1790455848,1790469552,1790483256,1790496960,1790510664,1790524368,1790538072,1790551776,1790565480,1790579184,1790592888,1790606592,1790620296,1790634000,1790647704,1790661408,1790675112,1790688816,1790702520,1790716224,1790729928,1790743632,1790757336,1790771040,1790784744,1790798448,1790812152,1790825856,1790839560,1790853264,1790866968,1790880672,1790894376,1790908080,1790921784,1790935488,1790949192,1790962896,1790976600,1790990304,1791004008,1791017712,1791031416,1791045120,1791058824,1791072528,1791086232,1791099936,1791113640,1791127344,1791141048,1791154752,1791168456,1791182160,1791195864,1791209568,1791223272,1791236976,1791250680,1791264384,1791278088,1791291792,1791305496,1791319200,1791332904,1791346608,1791360312,1791374016,1791387720,1791401424,1791415128,1791428832,1791442536,1791456240,1791469944,1791483648,1791497352,1791511056,1791524760,1791538464,1791552168,1791565872,1791579576,1791593280,1791606984,1791620688,1791634392,1791648096,1791661800,1791675504,1791689208,1791702912,1791716616,1791730320,1791744024,1791757728,1791771432,1791785136,1791798840,1791812544,1791826248,1791839952,1791853656,1791867360,1791881064,1791894768,1791908472,1791922176],"r_cum":[1.212,1.07,0.566,1.11,0.608,1.419,2.971,1.889,1.935,1.974,2.642,2.605,2.146,2.951,3.771,4.125,4.94,5.723,6.238,5.164,5.127,5.215,5.27,4.699,4.447,4.603,5.909,4.983,5.209,4.35,4.528,4.677,4.197,4.013,4.672,5.285,4.115,3.119,2.527,3.985,2.88,2.722,3.218,2.973,2.656,3.881,3.183,3.128,3.811,4.117,5.104,3.504,3.311,2.808,3.353,1.86,2.532,2.882,1.79,1.029,0.488,0.424,-0.831,-0.296,-1.391,-2.191,-2.681,-3.14,-4.427,-3.604,-3.516,-3.52,-1.92,-2.217,-3.817,-2.875,-1.89,-2.38,-2.204,-2.315,-2.557,-3.223,-2.924,-4.524,-5.474,-7.074,-6.707,-6.457,-5.561,-7.161,-8.761,-9.481,-9.592,-8.856,-9.539,-9.008,-7.408,-7.415,-7.315,-8.886,-7.704,-8.481,-8.113,-7.377,-7.073,-8.516,-7.62,-7.936,-7.27,-7.838,-7.528,-8.361,-9.961,-11.344,-12.554,-11.919,-11.52,-10.726,-11.386,-10.009,-9.265,-9.537,-9.237,-10.538,-8.938,-9.353,-8.911,-9.956,-9.992,-11.592,-13.095,-14.226,-13.084,-14.137,-14.297,-14.467,-13.639,-14.396,-15.152,-14.644,-14.237,-14.702,-13.875,-15.068,-14.218],"split_index":[120,145]}},{"id":"S03","name":"THREE_RED_GREEN_WICK · NORMAL · 60s · RANGE","pattern":"THREE_RED_GREEN_WICK","action":"NORMAL","horizon_s":60,"regime":"RANGE","status":"REJECTED","p_adj":0.967,"splits":{"train":{"trades":75,"mean_r":-0.116,"ci_low":-0.292,"ci_high":0.094,"win_rate":0.44,"profit_factor":0.738,"max_dd_r":15.79},"validation":{"trades":30,"mean_r":0.085,"ci_low":-0.115,"ci_high":0.287,"win_rate":0.567,"profit_factor":1.28,"max_dd_r":3.95},"test":{"status":"NOT_EVALUATED","trades":null,"mean_r":null}},"equity":{"t":[1789948800,1789967725,1789986650,1790005575,1790024500,1790043425,1790062350,1790081275,1790100200,1790119125,1790138050,1790156975,1790175900,1790194825,1790213750,1790232675,1790251600,1790270525,1790289450,1790308375,1790327300,1790346225,1790365150,1790384075,1790403000,1790421925,1790440850,1790459775,1790478700,1790497625,1790516550,1790535475,1790554400,1790573325,1790592250,1790611175,1790630100,1790649025,1790667950,1790686875,1790705800,1790724725,1790743650,1790762575,1790781500,1790800425,1790819350,1790838275,1790857200,1790876125,1790895050,1790913975,1790932900,1790951825,1790970750,1790989675,1791008600,1791027525,1791046450,1791065375,1791084300,1791103225,1791122150,1791141075,1791160000,1791178925,1791197850,1791216775,1791235700,1791254625,1791273550,1791292475,1791311400,1791330325,1791349250,1791368175,1791387100,1791406025,1791424950,1791443875,1791462800,1791481725,1791500650,1791519575,1791538500,1791557425,1791576350,1791595275,1791614200,1791633125,1791652050,1791670975,1791689900,1791708825,1791727750,1791746675,1791765600,1791784525,1791803450,1791822375,1791841300,1791860225,1791879150,1791898075,1791917000],"r_cum":[0.13,-1.033,-2.461,-3.78,-2.605,-2.35,-2.324,-2.388,-2.966,-4.566,-4.785,-3.664,-5.264,-6.6,-7.2,-8.143,-7.529,-5.929,-6.225,-4.979,-6.269,-7.45,-6.124,-6.172,-7.504,-7.768,-8.668,-8.064,-8.667,-10.267,-11.102,-10.396,-10.44,-11.572,-12.145,-11.941,-12.88,-13.353,-14.953,-15.662,-14.743,-14.757,-13.522,-13.52,-15.12,-15.208,-15.594,-15.468,-13.868,-13.824,-13.384,-13.107,-13.92,-12.658,-11.901,-11.017,-9.952,-9.264,-9.417,-9.047,-7.447,-8.296,-8.018,-7.242,-7.493,-7.578,-6.952,-7.668,-8.892,-7.292,-6.647,-7.386,-8.637,-8.303,-8.711,-9.626,-9.201,-7.988,-8.173,-7.453,-6.692,-5.941,-4.613,-5.046,-6.542,-6.221,-7.821,-7.302,-7.9,-6.778,-6.771,-6.314,-7.463,-7.152,-6.769,-7.122,-6.806,-8.009,-8.354,-8.562,-7.691,-7.935,-7.337,-7.748,-6.148],"split_index":[75,105]}},{"id":"S04","name":"THREE_GREEN_RED_WICK · NORMAL · 120s · VOLATILE","pattern":"THREE_GREEN_RED_WICK","action":"NORMAL","horizon_s":120,"regime":"VOLATILE","status":"REJECTED","p_adj":0.418,"splits":{"train":{"trades":97,"mean_r":-0.23,"ci_low":-0.404,"ci_high":-0.081,"win_rate":0.402,"profit_factor":0.545,"max_dd_r":25.83},"validation":{"trades":40,"mean_r":0.246,"ci_low":0.063,"ci_high":0.439,"win_rate":0.625,"profit_factor":2.022,"max_dd_r":2.96},"test":{"status":"NOT_EVALUATED","trades":null,"mean_r":null}},"equity":{"t":[1789948800,1789963305,1789977810,1789992315,1790006820,1790021325,1790035830,1790050335,1790064840,1790079345,1790093850,1790108355,1790122860,1790137365,1790151870,1790166375,1790180880,1790195385,1790209890,1790224395,1790238900,1790253405,1790267910,1790282415,1790296920,1790311425,1790325930,1790340435,1790354940,1790369445,1790383950,1790398455,1790412960,1790427465,1790441970,1790456475,1790470980,1790485485,1790499990,1790514495,1790529000,1790543505,1790558010,1790572515,1790587020,1790601525,1790616030,1790630535,1790645040,1790659545,1790674050,1790688555,1790703060,1790717565,1790732070,1790746575,1790761080,1790775585,1790790090,1790804595,1790819100,1790833605,1790848110,1790862615,1790877120,1790891625,1790906130,1790920635,1790935140,1790949645,1790964150,1790978655,1790993160,1791007665,1791022170,1791036675,1791051180,1791065685,1791080190,1791094695,1791109200,1791123705,1791138210,1791152715,1791167220,1791181725,1791196230,1791210735,1791225240,1791239745,1791254250,1791268755,1791283260,1791297765,1791312270,1791326775,1791341280,1791355785,1791370290,1791384795,1791399300,1791413805,1791428310,1791442815,1791457320,1791471825,1791486330,1791500835,1791515340,1791529845,1791544350,1791558855,1791573360,1791587865,1791602370,1791616875,1791631380,1791645885,1791660390,1791674895,1791689400,1791703905,1791718410,179173